{"applicability_resolution_sha256":"1a4a406da130eb34a7f6871e92230d0c82fe4bcf9e475651418780bedd5d1262","authoritative_applicability_resolution":{"additional_authoritative_evidence_acquisition_justified":false,"concrete_required_artifact":null,"different_semantic_roles":null,"human_production_binding_policy_required":true,"official_evidence_search_closed":true,"outcome":"authoritative-applicability-boundary-not-published","reason":"the official corpus publishes a logical BUILD schema and distinct geographic package members but no application-level rule selecting J13_BUILD or J17_BUILD for NMA production","selected_layer_id":null,"selection_rule":null},"build09f_readiness":"READY-FOR-BUILD-09F","claim_separation":{"existence_implies_applicability":false,"layer_existence":"established","layer_semantics":"established-within-versioned-logical-BUILD-and-delivered-package-scope","production_applicability":"not-published","semantic_similarity_implies_equivalence":false},"closed_vocabularies":{"applicability_outcomes":["J13-authoritative-production-binding","J17-authoritative-production-binding","version-scoped-dual-binding","different-semantic-roles","authoritative-applicability-boundary-not-published","authoritative-evidence-unavailable","indeterminate"],"gate_states":["P2-production-candidate","version-scoped-production-candidate","human-production-binding-policy-required","evidence-HOLD","local-policy-required","local-output-profile-policy-required"],"hypothesis_results":["evidenced-differentiator","not-supported-as-differentiator","not-established","not-applicable"],"readiness_decisions":["READY-FOR-BUILD-09F","AUTHORITATIVE-EVIDENCE-ACQUISITION-REQUIRED","J13-J17-AUTHORITY-STILL-INDETERMINATE"],"verdicts":["PASS — J13/J17 AUTHORITATIVE PRODUCTION BINDING RESOLVED; HUMAN POLICY GATE READY","PASS — OFFICIAL J13/J17 APPLICABILITY BOUNDARY CLOSED; HUMAN PRODUCTION BINDING POLICY REQUIRED","PASS — SPECIFIC AUTHORITATIVE EVIDENCE UNAVAILABLE; ACQUISITION REQUIRED","PASS — J13/J17 AUTHORITY REMAINS INDETERMINATE","FAIL — J13/J17 PRODUCTION APPLICABILITY BOUNDARY NOT ESTABLISHED"]},"contract_version":"build-09e2/1.0","created_on":"2026-08-21","evidence_items":[{"authority_class":"frozen-reviewed-project-evidence","claim":"BUILD-09E1 froze line code 2 at 0.20 mm, colour code 7 at black/RGB (0,0,0), all earlier portrayal findings, and isolated J13/J17 applicability as the only authoritative evidence question","evidence_id":"build09e1-frozen-targeted-resolution","identity":"record:f75c44bcb834090277588b3c23cfe48f00e965c947754497f64831d4b47b9b65","source":"data/specifications/nma-build-09e1-golden-targeted-official-evidence-resolution-v1.0.json"},{"authority_class":"authoritative-versioned-source-documentation","claim":"The original V4 workbook publishes logical BUILD geometry, fields, terrain classes, and semantics, and contains no J13_BUILD or J17_BUILD member binding","evidence_id":"official-v4-layer-workbook","identity":"V4; decision-date:2023-11-10; drive-size:569257; drive-modified:2024-01-25T08:59:54.631Z; sha256:d3f065a57d10c306e9e4e686641c07ddf2fb5a6d3638b68ec4d3ea533839f308","source":"多維度繪製圖層V4.xlsx; Drive file 1C12PmP-8ZZtZbHVKRAKv0mmWE22kgzEw"},{"authority_class":"authoritative-source-delivery-metadata","claim":"One delivery contains J13_BUILD under J13_寶山都市計畫 and J17_BUILD under J17_新竹科學工業園區特定區計畫(寶山部分); both are SHP PolygonZ members with the V4 BUILD field schema","evidence_id":"official-112-multidimensional-shp-delivery","identity":"sha256:4888dbf9a838ed5c41e20c3b528c542c7e52845b4d8e4809f58ea5afcec2da53","source":"data/datasets/112年多維度SHP成果_0502.zip"},{"authority_class":"reviewed-project-evidence","claim":"J13 DEMO selection was quality-bounded and J17 rejection reflected one invalid geometry; neither decision establishes official production applicability","evidence_id":"build00a-j13-j17-quality-observations","identity":"file-sha256:a5b089f7b8fac0ca4b6959594c27bdfe4a9be478c2e965f513d63bacbf92463d","source":"data/specifications/nma-build-fixture-manifest-v1.0.json"},{"authority_class":"implementation-evidence","claim":"The legacy runtime names J17_BUILD, but implementation history cannot establish official applicability","evidence_id":"legacy-j17-runtime-observation","identity":"file-sha256:d9eb720b5f84c35b63df8c9cd828a7530497d4b71f502117bdf7470148d890e9","source":"src/nma/real_layer.py"}],"five_gate_readiness":[{"gate_id":"hatch-angle-asset","reason":"official diagonal semantics and 2 mm spacing remain frozen; numeric angle and resource remain local","state":"local-policy-required"},{"gate_id":"annotation-placement-binding","reason":"official content semantics remain frozen; exact placement and collision behavior remain local","state":"local-policy-required"},{"gate_id":"j13-j17-identity","reason":"the official applicability boundary is closed without an NMA application selection","state":"human-production-binding-policy-required"},{"gate_id":"line-colour-portrayal","reason":"official 0.20 mm and black RGB (0,0,0) are closed; output conversion remains local","state":"local-output-profile-policy-required"},{"gate_id":"polygonz-derived-xy","reason":"immutable recoverable PolygonZ and non-writing derived XY remain frozen","state":"P2-production-candidate"}],"frozen_non_j13_j17_findings":{"annotation_closure":{"collision_suppression":{"official_semantics":"avoid interference with features and other annotations","outcome":"local-policy-required","unofficial_detail":"priority, fit, and suppression algorithm"},"content":{"outcome":"officially-supported","rule":"floor count followed by structure"},"field_binding":{"outcome":"documented-source-semantics","rule":"{BUILD_NO}{BUILD_STR}","scope":"112 multidimensional source package only"},"formatting_order":{"outcome":"documented-source-semantics","rule":"floor then structure; exact typography and separator remain local policy"},"placement":{"official_semantics":"center in or near the feature at an appropriate location; do not cover the feature; avoid mapped features, control points, and grid lines","outcome":"local-policy-required","unofficial_detail":"exact anchor algorithm"},"scale_visibility":{"official_semantics":null,"outcome":"local-policy-required","unofficial_detail":"web zoom thresholds"}},"colour_code_7_resolution":{"authority_boundary":"official table defines semantic black and the original RGB (R-G-B) value (0,0,0); no HEX notation is stated","evidence_ids":["nlsc112v5.4-building-portrayal-row","nlsc112-18-portrayal-code-table"],"official_code":"7","official_hex":null,"original_representation":{"components":[0,0,0],"representation":"RGB值 (R-G-B)","value_text":"(0,0,0)"},"outcome":"official-device-value-established","semantic_name":"黑色"},"hatch_angle":{"forbidden_inference":"diagonal does not establish 45 degrees","outcome":"local-policy-required-with-official-diagonal-semantics","value_degrees":null},"hatch_pattern_orientation":{"numeric_angle":null,"outcome":"officially-supported","semantic":"diagonal rising from lower-left to upper-right"},"hatch_resource":{"allowed_form":"procedural-or-independently-reviewed-equivalent","created_or_deployed":false,"exact_asset_required":false,"outcome":"local-policy-required"},"hatch_spacing":{"outcome":"officially-supported","unit":"mm","value":2.0},"line_code_2_resolution":{"authority_boundary":"official physical/cartographic width is 0.20 mm; device/CSS conversion is not prescribed by the cited table","css_px":null,"device_conversion_authorized":false,"evidence_ids":["nlsc112v5.4-building-portrayal-row","nlsc112-18-portrayal-code-table"],"official_code":"2","official_symbolic_name":"2號線","outcome":"official-physical-width-established","physical_width":{"unit":"mm","value":0.2,"value_text":"0.20"},"source_representation":"圖式線號 table; 單位:mm公釐; code 2; 規格 0.20"},"output_profile_requirement":{"local_decisions":["physical-mm-to-CSS-pixel conversion","screen scale and DPI assumptions","MapLibre colour serialization without claiming an official HEX value","opacity and antialiasing behavior"],"local_values_selected":false,"must_preserve":["line code 2 physical width 0.20 mm","colour code 7 original RGB (R-G-B) value (0,0,0)"],"pipeline":["official-portrayal-semantics","authorized-local-output-profile","MapLibre-device-representation"],"required":true,"status":"local-output-profile-policy-required"},"polygonz_derived_xy":{"derived_xy_representation":{"authoritative":false,"geometry_repair_permitted":false,"materialization":"ephemeral-or-content-addressed-read-only-cache","non_writing":true,"purpose":"portrayal-only","rendering_consumes_derived_only":true,"source_mutation_capability":false},"legacy_drop_z_path":{"classification":"incompatible","disposition":"bypassed-by-future-non-writing-derived-view-adapter","reuse_as_is_allowed":false},"pipeline":["authoritative-PolygonZ","immutable-source-representation","derived-non-writing-XY-portrayal-view","rendering-adapter"],"production_execution_allowed":false,"provenance_binding_required":["source archive SHA-256","selected source layer and component SHA-256 values","source feature identity","source PolygonZ geometry hash including Z","derivation algorithm and version","source and output CRS","derived XY content hash"],"source_mutation_authority":false,"source_representation":{"authoritative":true,"immutable":true,"write_handle_exposed_to_deriver":false,"z_values_preserved_and_recoverable":true},"status":"production-candidate-design-only"}},"j13_evidence_trace":{"authority_class":"authoritative-official-corpus","layer_id":"J13_BUILD","missing_edges":["production_applicability"],"trace":{"building_semantic_meaning":{"evidence_ids":["official-v4-layer-workbook","official-112-multidimensional-shp-delivery"],"status":"established","value":"BUILD polygon carrier for permanent, under-construction, and temporary Building terrain classes 9310100/9310200/9310300"},"dataset_product":{"evidence_ids":["official-112-multidimensional-shp-delivery"],"status":"established","value":"112年多維度SHP成果_0502;